,text,start,duration
1022,let's take a look. So the applicant is eligible for a loan,4144.0,4.0
1023,for a loan because they have good credit. If you change this to false ,4148.0,4.0
1024,"but set the other condition to true, we still",4152.0,4.0
1025,"see the same result, but if both these conditions are false ",4156.0,4.0
1026,then we're not going to see this message anymore. So this is the difference ,4160.0,4.0
1027,between these operators. With the logical and operator ,4164.0,4.0
1028,"both conditions should be true, with the logical ",4168.0,4.0
1029,or operator at least one condition should be true,4172.0,4.0
1030,we also have another logical operator called not,4176.0,4.0
1031,"and that basically inverses any boolean value we give it, if we give it, ",4180.0,4.0
1032,we give it a true boolean value it converts it to false. For example ,4184.0,4.0
1033,"let's make up a new room, if applicant ",4188.0,4.0
1034,has good credit and doesn't have ,4192.0,4.0
1035,a criminal record then,4196.0,4.0
1036,"they're eligible for a loan. Let me show you how to implement this. So, ",4200.0,4.0
1037,"we go back to our program, in this example we don't need a ",4204.0,4.0
1038,first variable for let's delete that. Let's set this variable to true,4208.0,4.0
1039,we also define another variable like has criminal ,4212.0,4.0
1040,record. We set this to false. ,4216.0,4.0
1041,"Now, we want to check to see if this applicant has good credit and not",4220.0,4.0
1042,a criminal record. This is where we use the not operator. ,4224.0,4.0
1043,"So, if they have good credit, ",4228.0,4.0
1044,and not criminal ,4232.0,4.0
1045,"record. So, in this example, has criminal",4236.0,4.0
1046,"record is set to false, when we use the not operator this",4240.0,4.0
1047,"basically gets changed to true, so we have two conditions that are true. ",4244.0,4.0
1048,Here's ones and here's another one. So our applicant is,4248.0,4.0
1049,eligible for a loan. And when we run this program we see,4252.0,4.0
1050,this familiar message. However,4256.0,4.0
1051,"if an applicant has a criminal record, so let's change this to ",4260.0,4.0
1052,"true, now when we run this program we can see our applicant is",4264.0,4.0
1053,not eligible because when we apply then operator on this,4268.0,4.0
1054,"variable, we'll get false. So true changes to false. ",4272.0,4.0
1055,"And we'll end up with two conditions, one that's true",4276.0,4.0
1056,and the other is false. And that's why this message is,4280.0,4.0
1057,not printed. So this is all about the logical operators in,4284.0,4.0
1058,python. ,4288.0,4.0
1059,In this tutorial I'm going to talk to you guys about,4292.0,4.0
1060,comparison operators in Python. We use comparison operators,4296.0,4.0
1061,"in situations where we want to compare a variable with a value, ",4300.0,4.0
1062,"for example, if temperature is greater than 30, then",4304.0,4.0
1063,"we want to print it's a hot day. Otherwise, if it's less",4308.0,4.0
1064,"then 10, it's a cold day, otherwise it it's neither hot",4312.0,4.0
1065,"nor cold. And by the way I'm taking about celsius, not farenheit. ",4316.0,4.0
1066,"So, to build these rules into our program, we need to use comparison",4320.0,4.0
1067,"operators. Back to app.py, I define this",4324.0,4.0
1068,"temperature value, let's write an if statement, if temperature",4328.0,4.0
1069,"now we want to check to see if this is greater than 30, so we use ",4332.0,4.0
1070,"the greater than operator. If this is greater than 30, ",4336.0,4.0
1071,we want to print it's a hot day,4340.0,4.0
1072,"otherwise, let's just print ",4344.0,4.0
1073,"it's not a hot day. Now, ",4348.0,4.0
1074,"when we run this program, we're going to see this second message because 30",4352.0,4.0
1075,is not greater than 30. So our first condition a value,4356.0,4.0
1076,"is to false. let's verify that. So run, ",4360.0,4.0
1077,it's not a hot day. Now if you change,4364.0,4.0
1078,"the temperature to 35 and run this again, ",4368.0,4.0
1079,"we're going to see a different message, it's a hot day, so this is where we use",4372.0,4.0
1080,comparison operators. Now what we have here as you know is an expression,4376.0,4.0
1081,because it's a piece of code that produces a value. So more accurately this is,4380.0,4.0
1082,"a boolean expression. So this is the greater than operator, ",4384.0,4.0
1083,"we also have greater than or equal to, we have",4388.0,4.0
1084,"less then, less then or equal to, ",4392.0,4.0
1085,"here's the equality operator, so if the temperature equals to 30, ",4396.0,4.0
1086,then you can say it's a hot day. Note that this is different from the assignment operator ,4400.0,4.0
1087,that has only one equals sign. You can see that if we use only one equal sign,4404.0,4.0
1088,here we immediately get this red underline because this is simply ,4408.0,4.0
1089,an assignment statement. We're changing the value of the temperature. ,4412.0,4.0
1090,you are setting the value of,4416.0,4.0
1091,"something else. So we don't have a boolean expression, you are not producing a ",4420.0,4.0
1092,"boolean value. Okay? So, our equality operator ",4424.0,4.0
1093,has two equal signs and finally we have not,4428.0,4.0
1094,equal which is an exclamation followed by an equal sign. ,4432.0,4.0
1095,Now here's an exercise for you. You have probably seen that when you fill out a ,4436.0,4.0
1096,"form online, sometimes the input fields have validation messages, ",4440.0,4.0
1097,"for example, let's say we have an input field for the user to enter their name. ",4444.0,4.0
1098,Now if the name is less then 3 characters wrong we want to display a validation ,4448.0,4.0
1099,"error, like name must be at least three characters, ",4452.0,4.0
1100,"otherwise, if the name is more then 50 characters long then we want ",4456.0,4.0
1101,to display a different validation error like name can be a maximum,4460.0,4.0
1102,of 50 characters. Otherwise if the name is between 3 and 50 characters,4464.0,4.0
1103,then we just want to tell the user that name looks good. ,4468.0,4.0
1104,"So go ahead, and write a plan to implement these rules. ",4472.0,4.0
1105,Alright let's define a variable called name and set it to,4480.0,4.0
1106,let's say j. So we're assuming this is what the user types into an input field.,4484.0,4.0
1107,"Now, we want to get the number of characters in this string. ",4488.0,4.0
1108,"So we use the len function, right? Len of name.",4492.0,4.0
1109,"When we print this we get 1, right",4496.0,4.0
1110,you have seen this before. Now here we want to use an if statement so,4500.0,4.0
1111,if len of name is less then ,4504.0,4.0
1112,"3, then we want to print ",4508.0,4.0
1113,name must be at least 3 characters,4512.0,4.0
1114,now here we need a second condition ,4516.0,4.0
1115,to check the upper limit. So el if,4520.0,4.0
1116,"len of name is greater than 50, ",4524.0,4.0
1117,"then we want to print a different message, name, ",4528.0,4.0
1118,must be a maximum ,4532.0,4.0
1119,of 50 characters. ,4536.0,4.0
1120,Okay? And otherwise if else,4540.0,4.0
1121,"none of these conditions are true that means the name looks good. So, ",4544.0,4.0
1122,"print, name looks good. Let's ",4548.0,4.0
1123,run our program. So in this case we get this message,4552.0,4.0
1124,because our name is too short. Now if you go back here and ,4556.0,4.0
1125,type something really really long. And then,4560.0,4.0
1126,we run our program we're going to see a different message name must be a ,4564.0,4.0
1127,maximum of 50 characters and finally if,4568.0,4.0
1128,we type a proper name here like John Smith,4572.0,4.0
1129,and run our program we get name ,4576.0,4.0
1130,looks good. ,4580.0,4.0
1131,Here's another good exercise that combines ,4584.0,4.0
1132,"many of the materials you have learned so far, so earlier you built a program to ",4588.0,4.0
1133,convert someone's weight from pounds to kilograms. Now we want to extend this program ,4592.0,4.0
1134,and allow the user to enter their weight in either kilograms or,4596.0,4.0
1135,pounds and then we will convert it to the other unit. Here's how our program,4600.0,4.0
1136,is going to work. So I enter my weight in pounds so,4604.0,4.0
1137,100 and 60 now it's telling me if it's in pounds or,4608.0,4.0
1138,kilograms. So here I'm adding l to lbs or k for kilograms. ,4612.0,4.0
1139,"And by the way, this program is not case sensitive so",4616.0,4.0
1140,when I enter a capital l or lowercase l it takes ,4620.0,4.0
1141,it as pounds. Now it tells me ur set it to,4624.0,4.0
1142,"kilos. Let's run this program one more time, ",4628.0,4.0
1143,"this time I'm going to enter my weight in kilo's, so send it to",4632.0,4.0
1144,"is the weight and the unit is kilograms so k, ",4636.0,4.0
1145,and it says you are 160 pounds. ,4640.0,4.0
1146,"So go ahead and spend a few minutes on this exercise, you will see my solution next.",4644.0,4.0
1147,Alright first let's ask the user their weight. So we use the input,4652.0,4.0
1148,"function, weight colon we get the return value",4656.0,4.0
1149,and store it in the variable called weight.,4660.0,4.0
1150,"Now the second question, so one more time we use the input function",4664.0,4.0
1151,el for pounds. ,4668.0,4.0
1152,"Or k for kilograms. So, ",4672.0,4.0
1153,let's get that too and store it in a variable called unit ,4676.0,4.0
1154,now we need an if statement. So if unit ,4680.0,4.0
1155,equals l then we need to convert this weight ,4684.0,4.0
1156,"into kilograms. However, with this implementation we are only allowing ",4688.0,4.0
1157,"the user to enter a capitol l, if they enter a lowercase l ",4692.0,4.0
1158,this code is not going to work. So this is where we use the upper,4696.0,4.0
1159,method of string objects so this unit is a string because as I told you,4700.0,4.0
1160,"before, the input function always returns a string. ",4704.0,4.0
1161,"So, we can use the dot operator to access all it's methods or",4708.0,4.0
1162,"functions, here we call the upper method, this",4712.0,4.0
1163,will convert whatever the user enters to upper case and then we'll convert it ,4716.0,4.0
1164,"to a capital l. Now, if this condition is true, ",4720.0,4.0
1165,"then we need to get the weight and multiply it by 0, ",4724.0,4.0
1166,".45 However, as you know this",4728.0,4.0
1167,"weight is a string object, and we cannot multiply a string ",4732.0,4.0
1168,"by a floating point number, we talked about this earlier in this course. ",4736.0,4.0
1169,So first we need to convert this weight to a numerical value. So ,4740.0,4.0
1170,"right here, when we call the input function, we can get the return",4744.0,4.0
1171,"value and pass it to the int function. So, ",4748.0,4.0
1172,we call the int function and give it,4752.0,4.0
1173,"the return value of the input function. Now, the",4756.0,4.0
1174,in function will return an integer so we can store it in this weight ,4760.0,4.0
1175,"variable. So here's the converted weight, let's store it in",4764.0,4.0
1176,"a variable called converted, ",4768.0,4.0
1177,"then we print here we can use a formatted string, so",4772.0,4.0
1178,we prefix this string with f ur,4776.0,4.0
1179,we add curly braces to dynamically insert the value of,4780.0,4.0
1180,converted variable. And finally we add kilo.,4784.0,4.0
1181,"Otherwise, if the unit is kilograms. ",4788.0,4.0
1182,We need to divide the weight by 0.45. q,4792.0,4.0
1183,"So, weight divided by 0.45 and",4800.0,4.0
1184,"just to refresh your memory, this division operator returns a floating point number",4804.0,4.0
1185,but if we use double slashes we'll get an integer. ,4808.0,4.0
1186,"In this case, we want to get a floating point number, ",4812.0,4.0
1187,"finally let's print a formatted string, ur",4816.0,4.0
1188," curly braces, converted ",4820.0,4.0
1189,pounds. Okay? Now,4824.0,4.0
1190,let's run this program and see what happens. So weight is,4828.0,4.0
1191,160 and lbs in,4832.0,4.0
1192,"and that equals to 72 kilos, perfect, if we run it one more time, ",4836.0,4.0
1193,and enter 72 kilos ,4840.0,4.0
1194,we get 160 pounds.,4844.0,4.0
1195,In this tutorial I'm going to show you how to use y loops in python. We  ,4852.0,4.0
1196,use y loops to execute a block of code multiple times and there are often,4856.0,4.0
1197,useful in building interactive programs and games. In a future tutorial,4860.0,4.0
1198,I'm going to show you how to build a simple game using a y loop.,4864.0,4.0
1199,"So, let's get started with the basics, we write a y statement ",4868.0,4.0
1200,"and right after that, we type a condition followed by a colon",4872.0,4.0
1201,as long as this condition is true the quote that we write ,4876.0,4.0
1202,in this block will be repeatedly executed. Here is an example.,4880.0,4.0
1203,"We can define a variable like i, as in short for",4884.0,4.0
1204,index and set it to 1. Now we set our condition to,4888.0,4.0
1205,"i less than or equal to 5, so as long as I",4892.0,4.0
1206,"is less then or equal to 5, we can print i, ",4896.0,4.0
1207,"on the terminal. And then we need to increment i, ",4900.0,4.0
1208,by 1. So we set i to i plus 1. The reason,4904.0,4.0
1209,we do this is that if we don't do this I will be 1 forever,4908.0,4.0
1210,so we'll end up with an infinite loop. Because this condition will,4912.0,4.0
1211,"always be true. One is always less then 5, so in every iteration of this",4916.0,4.0
1212,"loop, we increment i by 1, so at some point, i is gonna be",4920.0,4.0
1213,six and then that is when this condition will be false and then,4924.0,4.0
1214,"we'll jump out of this loop, okay? Now to demonstrate how everything works",4928.0,4.0
1215,after this loop I'm going to add a print statement,4932.0,4.0
1216,say done. So note that these two lines,4936.0,4.0
1217,are indented so they are part of the y block. ,4940.0,4.0
1218,"Okay, now let's go ahead and run this program and see what happens. So, ",4944.0,4.0
1219,"take a look, we get the numbers 1-5 followed by",4948.0,4.0
1220,done. So heres how this program gets executed,4952.0,4.0
1221,first we set i to 1 now python interpreter executes line,4956.0,4.0
1222,"2, this condition is true because i is less then 5, ",4960.0,4.0
1223,so i is printed on the terminal and then incremented by,4964.0,4.0
1224,1. Then the control moves back to the beginning of the y loop.,4968.0,4.0
1225,"So it doesn't go to the next statement. So, ",4972.0,4.0
1226,we come back here and now we are in the second iteration. In the second iteration,4976.0,4.0
1227,"i is 2, and because 2 is less then 5, our condition is still",4980.0,4.0
1228,"true, so i will be printed on the terminal, and once again it will be",4984.0,4.0
1229,"incremented by 1, so at some point i is going to be 6, ",4988.0,4.0
1230,and that's when this condition will be false so our look will,4992.0,4.0
1231,be terminated and this done message will be printed on the terminal.,4996.0,4.0
1232,So this is the basics of y loops. Now let's make this program a little,5000.0,4.0
1233,bit more interesting. Here we can write an expression like this. We,5004.0,4.0
1234,"add a string, and in this string we add an asterisk",5008.0,4.0
1235,and then we multiply this string by i. So,5012.0,4.0
1236,"with this expression, we can repeat a string, when we multiply a string",5016.0,4.0
1237,"by a number, that string will be repeated. For example, if",5020.0,4.0
1238,"i is two, this expression will produce a ",5024.0,4.0
1239,string with two asterisks. Now let's run the program,5028.0,4.0
1240,and see what we get. So we see this little triangle ,5032.0,4.0
1241,"shape here. Because in the first iteration i is 1, so, ",5036.0,4.0
1242,1 times an asterisk produces 1 asterisk. ,5040.0,4.0
1243,"In the second iteration i is 2, so when we multiply 2",5044.0,4.0
1244,"by 1 asterisks, we'll get 2 asterisks. ",5048.0,4.0
1245,In this tutorial I'm going to show you how to use a y loop to build ,5056.0,4.0
1246,a guessing game like this. So we have this secret number which is currently set to,5060.0,4.0
1247,"9. Now the computer is asking me to make a guess. So, ",5064.0,4.0
1248,"let's say 1 is not right because the secret number is 9, okay, ",5068.0,4.0
1249,"try again, 2, no it's not right, let's try again, so I",5072.0,4.0
1250,only have three chances to make a guess. If I can't guess the number the program ,5076.0,4.0
1251,"tells me that  I failed. let's run the program one more time, this time",5080.0,4.0
1252,"I'm going to guess the number, it's 9, there you go, it says you in.",5084.0,4.0
1253,So let's go ahead and build this program using a y loop.,5088.0,4.0
1254,"Alright, let's start by defining a variable to store our secret number",5092.0,4.0
1255,"so, we call the secret underline number and set it to 9.",5096.0,4.0
1256,Now we need a while loop to repeatedly ask a user to,5100.0,4.0
1257,make a guess. So while condition colon,5104.0,4.0
1258,What is our condition here? Well we want to give our user a,5108.0,4.0
1259,"maximum of three guesses. So similar to the last tutorial, we can define",5112.0,4.0
1260,"a variable like I, set it to 0, and assume this represents",5116.0,4.0
1261,the number of guesses the user has made. And then we write our condition ,5120.0,4.0
1262,as i less then 3. Note that here I'm not,5124.0,4.0
1263,"using less then or equal to operator, because with this condition",5128.0,4.0
1264,"our loop will be executed 4 times, while i is 0,",5132.0,4.0
1265,"one, two, and three, so here we should use ",5136.0,4.0
1266,the less then operator. Now if we give this code to someone else it's unclear,5140.0,4.0
1267,"what does i represent here, it's only in our head that",5144.0,4.0
1268,i represents the number of guesses the user has made. So as,5148.0,4.0
1269,"a best practice, always use meaningful and descriptive names for your variables. ",5152.0,4.0
1270,"So it's better to rename this variable to guess, count.",5156.0,4.0
1271,"Let me show you how to rename. So right click on i variable, ",5160.0,4.0
1272,and then go to refactor and ,5164.0,4.0
1273,rename it. Look at the shortcut. On a Mac computer it's shift and,5168.0,4.0
1274,f 6. Now in this dialogue box we can easily,5172.0,4.0
1275,rename your variable and pycharm will update all the references to that,5176.0,4.0
1276,"variable so we don't have to manually update each instance, okay? Let's",5180.0,4.0
1277,change this to guess_count,5184.0,4.0
1278,"enter, there you go, now that is better, ",5188.0,4.0
1279,also it's better to store 3 in a separate variable to make our code,5192.0,4.0
1280,"more readable, because it's not quite clear what does 3 represent here. ",5196.0,4.0
1281,"So, let's define a variable called guess limit",5200.0,4.0
1282,"say to 3, and then we can change 3 to guess",5204.0,4.0
1283,"underline limit, now our code is more readable",5208.0,4.0
1284,"while guess count is less then guess limit, see it reads like a story",5212.0,4.0
1285,"this is how you should write code. Okay, so",5216.0,4.0
1286,"while this condition is true, we want toast the user to make a guess. So here ",5220.0,4.0
1287,"we use our input function, guess",5224.0,4.0
1288,Now whatever the user enters comes out as a string so we need to convert it to an integer.,5228.0,4.0
1289,"So right here, we pass the result to the end function",5232.0,4.0
1290,and then get it and store it in a separate variable called guess.,5236.0,4.0
1291,"So at this point the user made a guess, now we need to",5240.0,4.0
1292,increment guess count so guess count,5244.0,4.0
1293,we set it to plus equal 1 or ,5248.0,4.0
1294,"okay, now we need to check to see if the user will make the right guess.",5252.0,4.0
1295,So here we need an if statement. If what the user guessed,5256.0,4.0
1296,"equals our secret number, ",5260.0,4.0
1297,again see our code is so readable. It's like a story you can read it like plain,5264.0,4.0
1298,English. So if this condition is true we want to ,5268.0,4.0
1299,tell the user they won. So print you won,5272.0,4.0
1300,now lets go ahead and run our program up to this point.,5276.0,4.0
1301,"So okay it's asking me to make a guess, I'm going to make ",5280.0,4.0
1302,"the wrong guess so one it asked me again, 2 one more time, ",5284.0,4.0
1303,"3, okay, what is missing in this implementation is the",5288.0,4.0
1304,"message that tells me that I failed. We're going to take care of it momentarily, but",5292.0,4.0
1305,"let's run the program one more time and make the right guess. So, 9",5296.0,4.0
1306,"okay it says you won, but it's still asking me to make",5300.0,4.0
1307,"a guess, because our while loop is going to get executed 3 times. Look",5304.0,4.0
1308,1 and 2. So we need to change our program,5308.0,4.0
1309,"such that if the user makes the right guess, we need to terminate our",5312.0,4.0
1310,"while loop, we need to jump out of it. How do we do that?",5316.0,4.0
1311,"So, over here if the user makes the right guess, after",5320.0,4.0
1312,we print this message we can use the brick statement to terminate,5324.0,4.0
1313,"terminate a loop, when python interpreter sees this, it's going to",5328.0,4.0
1314,"immediately terminate our loop, it's not going to evaluate this condition again. ",5332.0,4.0
1315,"Now let's run our program and see what happens. So, I'm going to",5336.0,4.0
1316,"guess the right number, you won and look, you are",5340.0,4.0
1317,"now asked to make two more guesses, beautiful. Now the last thing we need",5344.0,4.0
1318,to add here is the message that tells the user that they failed if they could not guess,5348.0,4.0
1319,the right number. How do we do that? Well in Python,5352.0,4.0
1320,our while loops can optionally have an else part. ,5356.0,4.0
1321,similar to the if statements. So earlier you learned that our if statements ,5360.0,4.0
1322,"can optionally happen else part. Here, so",5364.0,4.0
1323,"if this condition is true, do this,",5368.0,4.0
1324,otherwise do something else. In this case our if statement doesn't have,5372.0,4.0
1325,"an else part. Now, similar to the if statements",5376.0,4.0
1326,"Our while loops, our while statements can also have an else part. ",5380.0,4.0
1327,"So, right at this level we can add",5384.0,4.0
1328,"an else block, so else colon. ",5388.0,4.0
1329,And the code that we write here will get executed if this while loop,5392.0,4.0
1330,completes successfully without an immediate ,5396.0,4.0
1331,break. In other words. If the user guesses the,5400.0,4.0
1332,"right number, you break this loop, you jump out of it so the code that",5404.0,4.0
1333,we write in the else block will not get executed. ,5408.0,4.0
1334,"But if the user cannot guess this number, you're never going to break out of",5412.0,4.0
1335,"this loop, so this loop will be executed to completion untill",5416.0,4.0
1336,"this condition become false. In that case, the code that we write",5420.0,4.0
1337,"in the else block will get executed, and this is the perfect opportunity for us",5424.0,4.0
1338,"to tell the user hey, you made three guesses but none of them were right.",5428.0,4.0
1339,"So, print, sorry you",5432.0,4.0
1340,"failed. Now, let's test the program one more time.",5436.0,4.0
1341,"So, guess 1, 2, 3, ",5440.0,4.0
1342,"sorry you failed, let's run it one more time. This time I'm going to make",5444.0,4.0
1343,"a wrong guess, and then the right guess, ",5448.0,4.0
1344,we won and our loop terminated immediately. ,5452.0,4.0
1345,"Alright, now it's time for you to practice what you have learned so far. ",5460.0,4.0
1346,So once again we're going to build a game this game is a simulation ,5464.0,4.0
1347,card game. Now our game doesn't have a graphical user interface or gooey ,5468.0,4.0
1348,"and it doesn't really matter for now, our focus is entirely on building the",5472.0,4.0
1349,engine for this game. So let's see how this works. ,5476.0,4.0
1350,"When we run this, we get this little symbol here, and our program",5480.0,4.0
1351,is waiting for us to enter a command. If you type help,5484.0,4.0
1352,either a lower case or upper case we get the list of commands,5488.0,4.0
1353,that our program or our game currently supports. So we can type the,5492.0,4.0
1354,"start command to start our car, we can type",5496.0,4.0
1355,"stop command to stop our car, and quit to terminate the game.",5500.0,4.0
1356,Any other commands that we type our program is going to tell us hey I don't understand that.,5504.0,4.0
1357,"For example, if I type asd here, it's going to say I don't understand ",5508.0,4.0
1358,"that.If you type start, we get this message, ",5512.0,4.0
1359,"car started, ready to go, if you type stop it ",5516.0,4.0
1360,"says car stopped, and finally if we hit quit",5520.0,4.0
1361,"our program terminates, this is a fantastic exercise for you to practice",5524.0,4.0
1362,"wha you have learned, so pause the video and spend 5-10 minutes",5528.0,4.0
1363,to build this program. ,5532.0,4.0
1364,"Alright, we're going to start with a while loop with a condition ",5536.0,4.0
1365,What is our condition here? We want to run this loop ,5540.0,4.0
1366,until the user types quit. So we can define a variable,5544.0,4.0
1367,"or a story to command what the user enters, and then we can run this",5548.0,4.0
1368,loop as long as the command does not equal to quit. So right before,5552.0,4.0
1369,"the loop, we define a variable, command, and initially we set it",5556.0,4.0
1370,to an empty string. An empty string is a string that has no characters,5560.0,4.0
1371,in it. We only have the quotes. So then,5564.0,4.0
1372,we type out our condition as while command ,5568.0,4.0
1373,does not equal to quit then do something. ,5572.0,4.0
