,text,start,duration
0,"Hi, my name is Mosh, and I'm going to be your instructor in this Python course.",0.0,4.0
1,"In this course, you're going to learn everything you need to get started programming in Python.",4.0,4.0
2,"Python is one of the most popular programming languages, and every day people use it to do",8.0,4.0
3,"cool things like automation, they use it in AI, as well as",12.0,4.0
4,building applications and websites like Instagram and Dropbox. So if you're looking,16.0,4.0
5,"for a job, Python is for you. In this course I'm going to teach you everything ",20.0,4.0
6,you need to get started with Python. We're going to talk about all the core concepts,24.0,4.0
7,"in Python, and then we're going to build three Python projects together.",28.0,4.0
8,Here's the first project we're going to build. We're going to learn how to create this beautiful website,32.0,4.0
9,for an imaginary grocery store. Here on the homepage we can see all,36.0,4.0
10,"of the products in the shop, and we also have an admin area for managing the",40.0,4.0
11,stock. We're going to build this using a popular Python framework called Django. ,44.0,4.0
12,"Now if you have never built a website before, don't worry, I will teach you everything from scratch. ",48.0,4.0
13,"You're also going to learn how to use Python in machine learning, or artificial intelligence. ",52.0,4.0
14,So you will learn how to write a Python programming that will predict,56.0,4.0
15,the music that people like based on their profile. Just like how YouTube,60.0,4.0
16,recommends videos based on the videos you have watched before. I will also show you ,64.0,4.0
17,python to automate boring repetitive tasks that waste your time. ,68.0,4.0
18,You will write a Python program that will process thousands of spreadsheets,72.0,4.0
19,in under a second. I've designed this Python course for anyone who wants to learn,76.0,4.0
20,"Python. If you're a beginner, don't worry, I will hold your hand through this entire course. ",80.0,4.0
21,"You're not too old or too young, and Python is super easy to learn. You can write your first",84.0,4.0
22,Python program in literally seconds. Plus I'm going to give you plenty,88.0,4.0
23,of exercises to help you build your confidence writing cool Python programs. ,92.0,4.0
24,"My name is Mosh, I'm a software engineer with two decades of experience ",96.0,4.0
25,and I've taught over 3 million people how to code. I'm super excited to be teaching you,100.0,4.0
26,Python in this course. So I hope you stick around and learn this beautiful ,104.0,4.0
27,powerful programming language. ,108.0,4.0
28,In this tutorial I'm going to show you how to download ,112.0,4.0
29,"and install Python on your computer. So the first thing I want you to do,",116.0,4.0
30,is open up your browser and head over to Python,120.0,4.0
31,".org. On this page click on downloads, ",124.0,4.0
32,"here you can see the latest version of Python currently, at the time of recording this video",128.0,4.0
33,the latest version is python 3.7.2. ,132.0,4.0
34,"Chances are in the future, when you are watching this tutorial, there is a newer ",136.0,4.0
35,"version of Python available, don't worry, all the materials you're going to learn in this course ",140.0,4.0
36,will apply to the latest version of Python as well. So let's go ahead,144.0,4.0
37,"and download Python 3, alright now, ",148.0,4.0
38,"look at your downloads folder, here, we should have Python 3 installer",152.0,4.0
39,"simply double click that, if you're on Windows ",156.0,4.0
40,"you're going to see this check box here, add Python to",160.0,4.0
41,"python, this is really important, make sure to tick this box, otherwise you're not going to be able to",164.0,4.0
42,"follow this tutorial. If you're on a Mac, ",168.0,4.0
43,"you're going to see an installer like this, with this setup wizard we're going to install Python 3",172.0,4.0
44,"on our computer. So simply click continue, and again, ",176.0,4.0
45,"and again, and agree with the license agreement, and ",180.0,4.0
46,"install it, this is going to take a few seconds so I'm going",184.0,4.0
47,to pause the recording. ,188.0,4.0
48,"Alright, we have successfully installed Python 3 on our computer. ",192.0,4.0
49,"Let's close this. Alright, next we need to install",196.0,4.0
50,"a code editor, we se a code editor to write our code, just like",200.0,4.0
51,"how we use Microsoft Word to write documents, we use a code editor to write",204.0,4.0
52,"code. Now there are so many code editors out there, the one that I'm going to show you in this",208.0,4.0
53,tutorial is PyCharm. That is one of the most popular code editors ,212.0,4.0
54,for writing Python code. You can get it from jetbrains.com,216.0,4.0
55,/pycharm. Now more accurately pycharm ,220.0,4.0
56,"is considered an IDE, which is short for integrated development",224.0,4.0
57,"environment. And that's basically a code editor on steroids, ",228.0,4.0
58,it has some additional features that makes it really easy to write code. So,232.0,4.0
59,let's go ahead and download PyCharm. Now here on the,236.0,4.0
60,"download page, you can see two versions of PyCharm, one is the professional addition ",240.0,4.0
61,which has additional features and you have to pay for them. The other is the,244.0,4.0
62,"community edition, that is absolutely free, and that's what we're going to use in this tutorial. ",248.0,4.0
63,"So, go ahead and download this as well.",252.0,4.0
64,"Now, once again look at your downloads folder, once again you should have pycharm ",256.0,4.0
65,"so double click this, now if you're",260.0,4.0
66,"in Windows you're going to see an installation wizard, simply click next, next, next",264.0,4.0
67,until you install pycharm. If you're on Mac you need to drag and drop this icon ,268.0,4.0
68,"onto the applications folder, so drag and drop, ",272.0,4.0
69,"alright, now let's double click this to run it, ",276.0,4.0
70,"the first time we run pycharm we're going to get this warning, because this is an application",280.0,4.0
71,"that we download from the internet. So let's go ahead and open it, ",284.0,4.0
72,"next you're going to see this dialogue box for importing some settings, leave this to",288.0,4.0
73,"do not import settings, it doesn't really matter. Okay,",292.0,4.0
74,"On this page, select I've never used PyCharm you can see some keyword",296.0,4.0
75,"shortcuts that might be useful in the future, just accept this, and down at the bottom, ",300.0,4.0
76,"click the next button. And then next again,",304.0,4.0
77,"one more time, and then finally start using pycharm. ",308.0,4.0
78,So here's the main page of PyCharm every time you open,312.0,4.0
79,"it, click on create new project, ",316.0,4.0
80,"this is the location for our project, let's call our project Hello",320.0,4.0
81,"World. Now before click and create, expand ",324.0,4.0
82,"this item here, make sure that base interpreter is set to Python",328.0,4.0
83,3. Python interpreter is basically a program ,332.0,4.0
84,"that knows how to execute Python code, it will know how to interpret ",336.0,4.0
85,or translate Python instructions into instructions a computer can understand. ,340.0,4.0
86,"Now, Mac computers, by default come with an older",344.0,4.0
87,"installation of Python, that's Python 2, it's considered legacy",348.0,4.0
88,which means it's no longer maintained or supported. So earlier we downloaded ,352.0,4.0
89,"Python 3, make sure that this is set to Python 3, if not",356.0,4.0
90,"from this list, select Python 3.7. ",360.0,4.0
91,"Alright, now let's go ahead and create this project,",364.0,4.0
92,Now here right click on,372.0,4.0
93,Hello World folder and go to new ,376.0,4.0
94,"Python file, call this file app.py. ",380.0,4.0
95,"So by convention, all Python files should have this",384.0,4.0
96,"py extension. Alright, let's go ahead,",388.0,4.0
97,now let's collapse this project panel by clicking here and write our,392.0,4.0
98,"first python program. Simply type print, pr",396.0,4.0
99,"int, all in lowercase, open and close parenthesis, ",400.0,4.0
100,"and inside these parenthesis, add quotations we",404.0,4.0
101,"can either use single quotes or double quotes, now",408.0,4.0
102,"in between the codes write your name. I am Mosh Hamedani, so",412.0,4.0
103,"here, so this is your first Python programming. With these piece of code",416.0,4.0
104,"you can print your name on the screen. Now to run this, go",420.0,4.0
105,"on the top, under the run menu, click run, ",424.0,4.0
106,"also note that there is a shortcut associated with this command, when",428.0,4.0
107,I program I always use shortcuts because that increases my productivity. ,432.0,4.0
108,"So here on a Mac computer, the shortcut is control, option, and",436.0,4.0
109,"R. On Windows it's different. So let's do that, now",440.0,4.0
110,"it's asking where you want to run this, click on app, ",444.0,4.0
111,"down below, you should see this little terminal window, this",448.0,4.0
112,"is a little window into our program, so here you can see our results for",452.0,4.0
113,"output for our program. In the future as you learn more Python, you'll be",456.0,4.0
114,"able to build applications that have a graphical user interface, or gooey. ",460.0,4.0
115,"That is a little bit complicated, so for now we're going to use this little",464.0,4.0
116,terminal window to see the results of our program. So as you can see my name is,468.0,4.0
117,"printed here, now as you print code, this window might get in the way so",472.0,4.0
118,always resize it or minimize itty putting this,476.0,4.0
119,"icon here, so this was our first python program. Now",480.0,4.0
120,"if you didn't see the result I showed you in this video, use the comment box below and",484.0,4.0
121,"tell me what error you encountered, I'll do my best to help you move forward. ",488.0,4.0
122,"In this Python tutorial, we're gong to take this program to the next level and make it more interesting. ",496.0,4.0
123,So I'm going to show you how to draw a dog hair. Now as part of,500.0,4.0
124,this tutorial you will learn how Python code gets executed and you will also learn,504.0,4.0
125,"about a few programming terms. So press enter, and ",508.0,4.0
126,"on line 2 write another print statement, so print, open and close",512.0,4.0
127,"parenthesis, add a quotation, now here you want to draw a dog. ",516.0,4.0
128,"So, add an o, that is the head of our dog, followed by",520.0,4.0
129,4 hyphens. So this is the body. ,524.0,4.0
130,"alright, now one more time another print statement with",528.0,4.0
131,"quotations, now we need to draw the legs. So add a space. ",532.0,4.0
132,"Follow it by 4 vertical bars. So, like this, ",536.0,4.0
133,so here's a little imaginary dot. Now let's ,540.0,4.0
134,"run this program and see what we get. So on the top right corner you should see this play button, ",544.0,4.0
135,"click that, there you go, so we have our name and ",548.0,4.0
136,right below that we have our imaginary dog. Now what you need to understand ,552.0,4.0
137,"here, is that our python code gets executed line by line",556.0,4.0
138,from the top. So earlier I told you about Python interpreter ,560.0,4.0
139,that is the program that knows how to translate or interpret ,564.0,4.0
140,our Python code into instructions that a computer can understand.,568.0,4.0
141,"So when we run this program by clicking this program here, ",572.0,4.0
142,python interpreter starts executing or running our program ,576.0,4.0
143,"line by line from the top. So first it executes line 1, ",580.0,4.0
144,"then, moves onto line 2, and so on. So this is how python ",584.0,4.0
145,programs get executed. Now let me show you something cool. Let's add ,588.0,4.0
146,"another print statement, with quotations now",592.0,4.0
147,"in between the quotations, add a star or an asterisk, like",596.0,4.0
148,"this. Now after the quotation and before the parenthesis, ",600.0,4.0
149,"add a space, once again, add an asterisk, ",604.0,4.0
150,"space, 10. What is going on here? Well, ",608.0,4.0
151,anywhere we have quotations like here or here,612.0,4.0
152,"we're defining a string, a string is a programming term which means ",616.0,4.0
153,"a series of characters so here we have a string, we also have",620.0,4.0
154,"a string on line 3, as well as line 2 and line 1. ",624.0,4.0
155,"Now here, we're multiplying the string by ",628.0,4.0
156,"number 10. So this is the multiplication operator, just like the multiplication ",632.0,4.0
157,operator we have in math. So with this piece of code we can,636.0,4.0
158,"draw 10 asterisks on the terminal, let me show you. So let's run this",640.0,4.0
159,"program one more time, there you go. So we have 10",644.0,4.0
160,"asterisks. Now what we have here, this piece of code here, ",648.0,4.0
161,is called an expression. An expression is a piece of ,652.0,4.0
162,code that produces a value. So when Python interpreter ,656.0,4.0
163,"tries to execute line 4, first it will evaluate ",660.0,4.0
164,"the code that we put in between parenthesis, so we could evaluate our expressions ",664.0,4.0
165,Our expression will produce 10 asterisks and then,668.0,4.0
166,those asterisks will be printed on the terminal. Now as an exercise ,672.0,4.0
167,"you can use these print statements to draw another shape, you can draw a heart, a ",676.0,4.0
168,"ball, whatever you like. I will see you in the next tutorial. ",680.0,4.0
169,One of the questions I get a lot on my channel is,684.0,4.0
170,how long does it take to learn Python and become job ready? Well there is no single ,688.0,4.0
171,answer. It really depends on you and how much effort and commitment you want to put ,692.0,4.0
172,into this. But I would say if you spend 2 hours every day,696.0,4.0
173,"consistently, after about 3 months you should be able to write ",700.0,4.0
174,"basic python programs, but quite honestly, that doesn't get you a job. ",704.0,4.0
175,"In order to get a job, you need to specialize in one area,",708.0,4.0
176,what do you want to use python for? Do you want to build web applications or,712.0,4.0
177,desktop applications? Or do you want to use it in machine learning and artificial intelligence?,716.0,4.0
178,So whatever you want to do you need to take additional courses. ,720.0,4.0
179,For example if you want to become a web developer in addition to learning,724.0,4.0
180,"Python, you should also learn about html, some css, some",728.0,4.0
181,JavaScript and Django which is a popular Python framework ,732.0,4.0
182,for building web applications. Learning all these things would take you another ,736.0,4.0
183,"6 months, so in total you need 9-12 months to become",740.0,4.0
184,job ready. At that point you can get a junior developer job with a ,744.0,4.0
185,salary of about 50-60 thousand dollars a year. Now as you work more,748.0,4.0
186,"as you do more Python projects, your resume starts to build and ",752.0,4.0
187,"you can ask for $100,000 a year, or 120,000 dollars",756.0,4.0
188,"a year, depending on where you are, what company, what geographical area, ",760.0,4.0
189,"it really depends, there is no single answer. So are you excited to",764.0,4.0
190,"learn Python and get started on this career path? If you are, I would encourage you",768.0,4.0
191,to make a commitment and spend 2 hours every day practicing ,772.0,4.0
192,python. And use the comment box below and let me know why you are learning ,776.0,4.0
193,"Python, what do you want to do with it? What's your dream job? I would love to hear your story.",780.0,4.0
194,"In this Python tutorial, you're going to learn about variables, which are one of the most fundamental ",788.0,4.0
195,"concepts in programming, they're not specific to Python, they exist ",792.0,4.0
196,in pretty much every programming language out there. We use variables ,796.0,4.0
197,"to temporarily store data in a computer's memory. Here's an example, ",800.0,4.0
198,"let's type price = 10, when Python",804.0,4.0
199,"interpreter executes this code, it will allocate some memory, then it will store ",808.0,4.0
200,"the number 10 in that memory, and finally it will attach this",812.0,4.0
201,price label in that memory location. As a metahor,816.0,4.0
202,"imagine we have a box. In that box, we have number 10",820.0,4.0
203,and price is the label that we put on the box. Now we can use this label ,824.0,4.0
204,anywhere in our program to access the value that we have in that box. ,828.0,4.0
205,"This is a very simplified explanation. So now, let's ",832.0,4.0
206,"print price on the terminal. Print, now this time we're not going to",836.0,4.0
207,"add quotations, because if we put quotations here, we will see the text ",840.0,4.0
208,price on the terminal. Now the value of the price variable. ,844.0,4.0
209,"So, put it in quotations, and type price, ",848.0,4.0
210,"now, let's run this program one more time, there you go. So we see 10, ",852.0,4.0
211,"on the terminal. So this is how we define variables, we ",856.0,4.0
212,"start with an identifier which is the name of our variable, then, ",860.0,4.0
213,"an equal sign and finally a value. Now more accurately, when",864.0,4.0
214,"this number 10 is about to be stored in the memory, first it will",868.0,4.0
215,"get converted to this binary for presentation. So this number 10, ",872.0,4.0
216,is in the decimal system which has all the digits from 0 to 9. ,876.0,4.0
217,"Computers don't understand all these digits, they only understand ",880.0,4.0
218,0s and 1s. So when we store the number 10 in the computer's memory,884.0,4.0
219,first it will get converted to it's binary representation which will be ,888.0,4.0
220,"a bunch of 0's and 1's, like 001, 001, whatever ",892.0,4.0
221,"I don't know. Then it will get stored in the computer's memory. So,",896.0,4.0
222,let's take this program to the next level. On the second line we can ,900.0,4.0
223,"update the value of this price variable, so we can reset it",904.0,4.0
224,"to a new value like 20, now when we run our program, ",908.0,4.0
225,"we should see 20, because as I told you before Python interpreter executes our",912.0,4.0
226,code line by line from the top. So first we set ,916.0,4.0
227,"the price to 10, then we reset it to 20, and finally we ",920.0,4.0
228,"print it on the terminal, let's run the terminal, there you go, so, ",924.0,4.0
229,"we see 20 here, okay? Now these",928.0,4.0
230,numbers that we have here are whole numbers without a decimal point. ,932.0,4.0
231,"In programming, we refer to these numbers as integers. ",936.0,4.0
232,But integer is a number without a decimal point. We can also use,940.0,4.0
233,"numbers with a decimal point for example on line 2, we can define",944.0,4.0
234,another variable called rating and set it to number,948.0,4.0
235,"4.9. Now in programming, we refer to this kind of number as ",952.0,4.0
236,a floating point number of float for short. So we have integers ,956.0,4.0
237,and floats. We can also define a variable and set,960.0,4.0
238,"it to a string, for example, name equals ",964.0,4.0
239,"Mosh, we also have another kind of value which is called boolean, ",968.0,4.0
240,which can be true or false. They are line yes and no in English. ,972.0,4.0
241,"Here is an example, I'm going to define a variable, is underline",976.0,4.0
242,published so we use an underscore to separate,980.0,4.0
243,multiple words in our variables name. We set this to,984.0,4.0
244,"true, or false. These are",988.0,4.0
245,boolean values. now note that Python is a case ,992.0,4.0
246,"sensitive language, which means it's sensitive to lower case and upper case letters. ",996.0,4.0
247,So when defining variables we should always use ,1000.0,4.0
248,"lowercase letters, but here false and true are special keywords in the ",1004.0,4.0
249,"language, so if we spell it with a lowercase f, Python doesn't",1008.0,4.0
250,"understand it. You can see we have a red underline here, which indicates an error. ",1012.0,4.0
251,"Make sure to spell this with a capital F, or if you want to set this to true, ",1016.0,4.0
252,"make sure the T is capital, so in this",1020.0,4.0
253,"program, you're storing simple values in our computer's memory. Simple",1024.0,4.0
254,"values can be numbers, which can be integers or floats",1028.0,4.0
255,or they can be strings or booleans. But in Python ,1032.0,4.0
256,we can also store complex values like lists and values. And that's what I'm going to show you,1036.0,4.0
257,"in the future. So before going any further, I want you ",1040.0,4.0
258,to do a little exercise. Imagine we're going to write a program for a hospital. ,1044.0,4.0
259,So we check on a patient named John Smith. He's ,1048.0,4.0
260,"20 years old and is a new patient. I want you to define 3 variables here, ",1052.0,4.0
261,"for his name, his age, and another variable ",1056.0,4.0
262,for if this is a new or an existing patient. So pause the video and spend one,1060.0,4.0
263,"minute on this exercise. When you're done, come back, continue and see my solution. ",1064.0,4.0
264,"Alright, so here we need",1068.0,4.0
265,"three variables, the first one is the patient's name, ",1072.0,4.0
266,we set that to John Smith. We can also,1076.0,4.0
267,"call this full name, these are both valid names for our variables. ",1080.0,4.0
268,The second variable is for the age of our patient. So age ,1084.0,4.0
269,"is 20, and finally we need a variable to tell if this is a new ",1088.0,4.0
270,or existing patient. That's where we can use a boolean value. ,1092.0,4.0
271,"So, we define a variable, is new and ",1096.0,4.0
272,we set it to true. ,1100.0,4.0
273,"So, you have learned how to print",1104.0,4.0
274,"messages on the terminal window. In this tutorial, I'm going to show you how to ",1108.0,4.0
275,receive input from the user. So we're going to write a small program that asks ,1112.0,4.0
276,the user's name and then we'll print a greeting message customized,1116.0,4.0
277,for that user. So instead of print we're going to use,1120.0,4.0
278,input. Now both these input and print ,1124.0,4.0
279,are functions that are built into Python. As a metaphor think ,1128.0,4.0
280,of the remote control of the TV. On this remote control we have a bunch of ,1132.0,4.0
281,"buttons, these are the functions built into your tv, you can turn it on,",1136.0,4.0
282,"turn it off, change the volume and so on. In Python we also have ",1140.0,4.0
283,"functions for common tasks such as printing messages, receiving input, ",1144.0,4.0
284,"and so on. So we're going to use the input function, now whenever we",1148.0,4.0
285,"have these parenthesis, we're going to say we're calling or executing ",1152.0,4.0
286,"that function, it's like pressing a button on a remote control. So we're",1156.0,4.0
287,going to call the input function and in between parenthesis,1160.0,4.0
288,"we want to add a string to print something on the terminal, ",1164.0,4.0
289,what is your name? With a question mark followed by,1168.0,4.0
290,a space. You will see why in a second. So this input function,1172.0,4.0
291,"will print this message on the terminal, and then it will wait for the user to",1176.0,4.0
292,enter a value. Whatever the user enters this input function will,1180.0,4.0
293,return. So now we can get that value and store it in the memory using a variable. ,1184.0,4.0
294,So we get the result and put it in a variable called ,1188.0,4.0
295,name. Okay? Now on the second line,1192.0,4.0
296,"we want to print a message like Hi John or Hi Mosh or whatever, so, ",1196.0,4.0
297,"print, quotations Hi with a space,",1200.0,4.0
298,now after the quotation we want to dynamically print,1204.0,4.0
299,what we have in the name variable. So we had,1208.0,4.0
300,a plus sign and then name. So here we have,1212.0,4.0
301,"Hi which is a string, we're concatenating or",1216.0,4.0
302,"combining the string with another string, that is what we have",1220.0,4.0
303,in the name variable. So here's another example of,1224.0,4.0
304,an expression. Remember what is an expression? It's a piece of code that,1228.0,4.0
305,uses a value. So this expression concatenates or combines ,1232.0,4.0
306,2 strings. Let's run this program and see what happens. So run,1236.0,4.0
307,"okay, here is a question, what is your name? Mosh, ",1240.0,4.0
308,"now note that earlier we added a space after the question mark, we",1244.0,4.0
309,"did this, so here in the terminal window the cursor is",1248.0,4.0
310,"separated from the question mark, otherwise it would be so close. So let's type",1252.0,4.0
311,"whatever here, plus enter, now we get this message, Hi, Mosh. ",1256.0,4.0
312,Now here's a little exercise for you. I want you to extend this program,1260.0,4.0
313,and ask two questions. First all the person's name and then,1264.0,4.0
314,their favorite color. And then print a message like Mosh likes,1268.0,4.0
315,"blue. So pause the video, do this exercise and then come back and continue watching. ",1272.0,4.0
316,"Alright, so here's the first question right after that, ",1280.0,4.0
317,"all the input functions one more time, this time we're going to ask a different question. ",1284.0,4.0
318,What is your favorite color? ,1288.0,4.0
319,"Now, we get the new value and store it in the variable",1292.0,4.0
320,"called color, or you could call it favorite underline. ",1296.0,4.0
321,color. Either works. And finally we're going to change,1300.0,4.0
322,"what we pass to the print function, so first we print the name ",1304.0,4.0
323,"then we concatenate this with a string, here we're going to",1308.0,4.0
324,"type likes, we also put one space before and ",1312.0,4.0
