,text,start,duration
2074,30 let's add another key value pair is ,8396.0,4.0
2075,underline verified and we set this to a boolean.,8400.0,4.0
2076,Now what matters here is that these keys should be,8404.0,4.0
2077,"unique. So if I add another key value pair here, ",8408.0,4.0
2078,"set age to 40, now look pycharm",8412.0,4.0
2079,"has highlighted the age key, because we have duplicated that and",8416.0,4.0
2080,"that's not allowed. So each key should be unique in a dictionary, just like, ",8420.0,4.0
2081,"the dictionaries we have in the real world, in a real dictionary we have a bunch of words ",8424.0,4.0
2082,and they're definition each word is only listed once in a dictionary.,8428.0,4.0
2083,We don't have the word book twice. So let's delete the second,8432.0,4.0
2084,"duplicate key value pair, so the keys should be unique,",8436.0,4.0
2085,"and in this example, I'm using strings, but they can also be",8440.0,4.0
2086,"numbers, we're going to look at that later, but the value can be anything, it can be",8444.0,4.0
2087,"a string, a  number, a boolean, a list, literally anything.",8448.0,4.0
2088,Now we can access each item in this dictionary ,8452.0,4.0
2089,"using square brackets. So, we type customer, ",8456.0,4.0
2090,square brackets and then specify key like name,8460.0,4.0
2091,and this will return the value associated with,8464.0,4.0
2092,"the name key. Let's print it on the terminal, have a look,",8468.0,4.0
2093,"there you go, so, the name is John Smith, now",8472.0,4.0
2094,"what if we pass a key that doesn't exist, lets say first date.",8476.0,4.0
2095,"You run the program, you get a key error because we don't have",8480.0,4.0
2096,"a key called birth date. Also, if we spell",8484.0,4.0
2097,"name with let's say a capital N, we get the same",8488.0,4.0
2098,error because we don't have a key with the exact same sequence of,8492.0,4.0
2099,characters in this dictionary. Now to get around this we can,8496.0,4.0
2100,"use the get method, so instead of using the square brackets ",8500.0,4.0
2101,we call the get method and specify the key,8504.0,4.0
2102,"Now if you use a key that doesn't exist here, it doesn't yell at us. For example, ",8508.0,4.0
2103,if you pass birth date,8512.0,4.0
2104,it simply returns the non value. Earlier I told you that none is an object,8516.0,4.0
2105,that represents the absence of a value. So,8520.0,4.0
2106,instead of getting a key error we get none and we can also option,8524.0,4.0
2107,"supply a default value, for example, if this dictionary doesn't have this",8528.0,4.0
2108,"key, we can supply the default value, let's say",8532.0,4.0
2109,January 1st 1980. Let's run the program ,8536.0,4.0
2110,now instead of getting none we get this default value. ,8540.0,4.0
2111,"So, this is how we can access the value associated with the key",8544.0,4.0
2112,in a dictionary. We can also update these values for example ,8548.0,4.0
2113,"before a print statement we can write code like this, customer of",8552.0,4.0
2114,"name, let's update the name to jack ",8556.0,4.0
2115,"smith, now this little warning is telling us here we can put jac",8560.0,4.0
2116,"smith here instead of defining it once, and then update",8564.0,4.0
2117,"it. Don't worry about them, it doesn't really matter. Now with this line if ",8568.0,4.0
2118,"we print the name of this customer, we should see jack smith, let me show you.",8572.0,4.0
2119,"So, I'm going to use the square bracket notation again, let's print",8576.0,4.0
2120,"the name of the customer you can see that is updated here, ",8580.0,4.0
2121,"we can also add a new key here, let's set the",8584.0,4.0
2122,birthdate to some value like january first,8588.0,4.0
2123,"1980. And then we can print it here, ",8592.0,4.0
2124,so as you see we can easily add new key value pairs,8596.0,4.0
2125,to a dictionary. So this is the basics of using dictionaries,8600.0,4.0
2126,in python. They're extremely important and they have a lot of applications in the real,8604.0,4.0
2127,"world. Okay, here's an exercise for you. So here we have",8608.0,4.0
2128,this program that asks our phone number. Let's type 1,8612.0,4.0
2129,234. We type it in digits and then this will translate,8616.0,4.0
2130,"it, to words, take a look. Enter, it prints, 1, 2, 3, ",8620.0,4.0
2131,"4. That's a pretty cool program, so go ahead and",8624.0,4.0
2132,"spend a few minutes on this exercise, it's pretty easy, I will see you",8628.0,4.0
2133,next. ,8632.0,4.0
2134,"Alright, so first we need to get the users phone number, we call the input function ",8636.0,4.0
2135,"with the label phone, we get the result and store it",8640.0,4.0
2136,"in this variable, now let's say the user enters 123",8644.0,4.0
2137,"4. So we need to look through this string, get each character and ",8648.0,4.0
2138,"translate it to a world, so what we need to implement this scenario.",8652.0,4.0
2139,"is a dictionary, because a dictionary is a structure that allows us to",8656.0,4.0
2140,a key to a value. So we can have a dictionary with keys,8660.0,4.0
2141,like 1234. And we map each of these keys,8664.0,4.0
2142,to a word. So we cannot put digit 1 to,8668.0,4.0
2143,the word 1 we can map 2 ,8672.0,4.0
2144,to two you get the point. So let's define ,8676.0,4.0
2145,"a dictionary, you can call it digits, underline mapping",8680.0,4.0
2146,now this dictionary I'm going to add a few key value pairs. ,8684.0,4.0
2147,"One, we map it to 1, 2, we ",8688.0,4.0
2148,"to 2, 3, to 3, ",8692.0,4.0
2149,"and finally, 4 to 4. Now technically we should",8696.0,4.0
2150,"add all the digits from 0 to 9, but I don't want to waste all your time ",8700.0,4.0
2151,"typing repetitive things here, you got the point. So lets move on,",8704.0,4.0
2152,now we need to look through the phone string. So ,8708.0,4.0
2153,"4 character in phone, we get each",8712.0,4.0
2154,character and then use it to access a key value pair in,8716.0,4.0
2155,"dictionary. So, digits underline mapping",8720.0,4.0
2156,"we can use square brackets or call the get method, ",8724.0,4.0
2157,"I would prefer to use the get method, so in case the user enters some character",8728.0,4.0
2158,"that is not part of our dictionary, our program is not going to yell at them.",8732.0,4.0
2159,"So, we call the gt method and pass this character",8736.0,4.0
2160,"a the key, and if we don't have this key, we can supply",8740.0,4.0
2161,"a default value like exclamation mark, so with this we get a word",8744.0,4.0
2162,"now we need to add this word to an output string, so we can define",8748.0,4.0
2163,"an output string, initially we set it to an empty string, ",8752.0,4.0
2164,in each iteration we get this and add it to our output string. ,8756.0,4.0
2165,"So, we type output, plus equals. ",8760.0,4.0
2166,This and we should also add a ,8764.0,4.0
2167,"space at get. So the words are not close to each other, okay?",8768.0,4.0
2168,That's all we have to do. Now finally let's print,8772.0,4.0
2169,"this output, run our program, so I want to",8776.0,4.0
2170,"type 1, 3,4, 5, lets ",8780.0,4.0
2171,"see what we get. We get 1, 3, 4 with an exlamantion",8784.0,4.0
2172,mark. ,8788.0,4.0
2173,In this tutorial I'm going to show you something really cool,8792.0,4.0
2174,"that you can do with dictionaries, so here in this program you can type",8796.0,4.0
2175,"a message like good morning followed by a smiley face,",8800.0,4.0
2176,"when we press enter, we get this beautiful smiley face, or",8804.0,4.0
2177,"we can type i am sad, with a  sad smiley face",8808.0,4.0
2178,and it gets translated to this beautiful emoji. ,8812.0,4.0
2179,"So this is another application if using dictionaries, we have a dictionary ",8816.0,4.0
2180,that maps these characters into smiley faces. ,8820.0,4.0
2181,"So lets go ahead and build this program together, we start by",8824.0,4.0
2182,"calling the input function, here we pass a greater than symbol",8828.0,4.0
2183,"as an indicator for the user to type a message, we give that message, store",8832.0,4.0
2184,"it here, as you know that is a string, now we need to",8836.0,4.0
2185,"split this string by a space, so if the user types",8840.0,4.0
2186,"good morning with a smiley face, we want to break this down into",8844.0,4.0
2187,"3 words, good morning, and smiley face. ",8848.0,4.0
2188,To do that we can call the split method. So we call,8852.0,4.0
2189,message.split and pass ,8856.0,4.0
2190,a string with one space as a separator. What this method,8860.0,4.0
2191,does is basically it goes through this string and anywhere it finds this,8864.0,4.0
2192,"character, in this case a space, it uses it as a boundary to",8868.0,4.0
2193,separate this string into multiple words. And then it will return,8872.0,4.0
2194,"a list. Let me show you. So let's store that here, words, and then",8876.0,4.0
2195,"Then print it on the terminal, ",8880.0,4.0
2196,let's go ahead and run our program. So if you type good morning ,8884.0,4.0
2197,"sunshine, enter, we get a list with three items ",8888.0,4.0
2198,"each item is a string, okay? Now, ",8892.0,4.0
2199,"back to our program, we need to define a dictionary for mapping special characters",8896.0,4.0
2200,"like these 2 into a smiley face, so, ",8900.0,4.0
2201,we can call that emojis ,8904.0,4.0
2202,"set it to curly braces, here we add a key value pair, ",8908.0,4.0
2203,"a smiley face, and we map that to a string, ",8912.0,4.0
2204,"in this string we want to add an emoji, if you're on a mac keyboard you can press ",8916.0,4.0
2205,control command and space and this should bring up,8920.0,4.0
2206,"this emoji box, if you're on Windows honestly I",8924.0,4.0
2207,"really don't know how you can do this, but there must be applications who do this for you. So lets go",8928.0,4.0
2208,"ahead and pick this happy smiley face, good, ",8932.0,4.0
2209,"now lets add another key value pair, or sad face",8936.0,4.0
2210,"we map this to, ",8940.0,4.0
2211,"this face here, good. So, we ",8944.0,4.0
2212,"have a list of words now we need to look through this list, get",8948.0,4.0
2213,each word and potentially map it to an emoji.,8952.0,4.0
2214,"So we can write a for loop for word in words, ",8956.0,4.0
2215,"now we want to go to our dictionary, and see if you have an item with this",8960.0,4.0
2216,"word as the key. If you have an item with that key, we get",8964.0,4.0
2217,"it's value, otherwise we want to use the same word. So if a user types",8968.0,4.0
2218,"good morning, we don't want to translate those words, we just want to return those. So that is the case, ",8972.0,4.0
2219,where we use the get method to supply a  default ,8976.0,4.0
2220,"value, so we wan to get an item with a key word, and",8980.0,4.0
2221,"if we don't have an item with that key, we simply use that word as ",8984.0,4.0
2222,the default value. Now similar to the exercise that we did in the last tutorial ,8988.0,4.0
2223,"we need an output variable. So let's define that here, ",8992.0,4.0
2224,"output set it to an empty string, now back to line",8996.0,4.0
2225,"9, we get the return value of the get method, ",9000.0,4.0
2226,and add it to our output variable. So output ,9004.0,4.0
2227,"plus equals whatever we get from the get method, and finally ",9008.0,4.0
2228,we need to append a space at the end. ,9012.0,4.0
2229,"That's it, we're done. So let's print the output ",9016.0,4.0
2230,and run our program and I'm going to type good morning,9020.0,4.0
2231,"sunshine with a smiley face, we get that ",9024.0,4.0
2232,"beautiful, let's try the sad face as well, I am sad. ",9028.0,4.0
2233,Too bad. Beautiful! So as you can see,9032.0,4.0
2234,dictionaries have a lot of use cases in real applications.,9036.0,4.0
2235,Here's a solution from the last tutorial where we created an emoji ,9044.0,4.0
2236,"converter. Now so far we have been writing all our code right here,",9048.0,4.0
2237,"in app,py, but as our programs grow we need a better way to organize our code. ",9052.0,4.0
2238,"We need to break up our code into smaller, more manageable ",9056.0,4.0
2239,and more maintainable chunks which we call functions. So function ,9060.0,4.0
2240,is a container for a few lines of code that perform a specific ,9064.0,4.0
2241,task for example you have learned about a few of the built in functions in,9068.0,4.0
2242,"python like print, and input, each of these functions ",9072.0,4.0
2243,"have a purpose, they know how to perform a specific task. So when we ",9076.0,4.0
2244,"build large complex programs, we should break up our code into smaller ",9080.0,4.0
2245,reusable chunks which we call functions to better organize our code.,9084.0,4.0
2246,And that's what I'm going to show you in this tutorial. So let's write this simple ,9088.0,4.0
2247,"program, for printing a greeting message. So we're going to do a print, ",9092.0,4.0
2248,"hi there, and lets add another message ",9096.0,4.0
2249,welcome aboard. So here we have a simple ,9100.0,4.0
2250,program with only two lines of code. Now let's say these two lines ,9104.0,4.0
2251,potentially we're going to need them in other programs so we can put them in a function that,9108.0,4.0
2252,"we can reuse. Let me show you how to do that, so, ",9112.0,4.0
2253,"we start typing out death, that is a reserve keyword in",9116.0,4.0
2254," Python, and it's short for define. When Python interpreter sees this it",9120.0,4.0
2255,"knows that we're defining a function, next we need to give our function ",9124.0,4.0
2256,"a name, lets say greet_user.",9128.0,4.0
2257,"So all the best practices you learned about naming your variables also apply here, ",9132.0,4.0
2258,which means we should name our functions with lower case characters ,9136.0,4.0
2259,"if there are multiple words, we need to separate them using an underscore ",9140.0,4.0
2260,"and you should always, always, always use meaningful",9144.0,4.0
2261,"descriptive names for your functions. So, here we define a function",9148.0,4.0
2262,"called greet user, after that we'll need to add parenthesis ",9152.0,4.0
2263,followed by a colon. Now you know that whenever we add a colon at the end of a line,9156.0,4.0
2264,we're telling python that we're defining a block of code. So when we ,9160.0,4.0
2265,"press enter, the next line is indented. Now any code that we write here",9164.0,4.0
2266,will belong to this function. So I'm going to move these two lines,9168.0,4.0
2267,these two print statements inside of our function. You can simply ,9172.0,4.0
2268,"press tab to indent them, beautiful, also lets remove",9176.0,4.0
2269,"this extra line break, that is better, so these two lines",9180.0,4.0
2270,"now are part of our greet user function, so whenever we ",9184.0,4.0
2271,"call this function, these two lines will be executed. Okay? Now, ",9188.0,4.0
2272,"let's remove indentation so here we are outside of our function, ",9192.0,4.0
2273,let's do a print statement and print start,9196.0,4.0
2274,"after that let's call our function, so greet user.",9200.0,4.0
2275,And finally let's do another create statement and print,9204.0,4.0
2276,"finish. Now we have this little warning here, this",9208.0,4.0
2277,"underline, if you hover your mouse over this line, this tool was telling you",9212.0,4.0
2278,that we should add two blank lines after a function definition. This is coming from,9216.0,4.0
2279,pep8 which is a document that defines the best practices for,9220.0,4.0
2280,formatting our code. We'll look at that in the future. So for now to make pycharm,9224.0,4.0
2281,"happy, lets add an extra line break to this function",9228.0,4.0
2282,so whenever we define a function we need to add two lines breaks after.,9232.0,4.0
2283,"Okay? so, now let's run our program and see what happens.",9236.0,4.0
2284,"Alright, so we have 4 messages on the terminal ",9240.0,4.0
2285,first we get the start message then we get the messages,9244.0,4.0
2286," coming from our create function, so either and welcome aboard, and finally we see",9248.0,4.0
2287,the finished message. So let me explain the flow of our program ,9252.0,4.0
2288,when python runs this code it doesn't actually print these,9256.0,4.0
2289,two messages on the terminal because these two lines of code are inside,9260.0,4.0
2290,"of this function, so they would only get executed if we call",9264.0,4.0
2291,"this function. If we don't call this function, these lines don't get executed. ",9268.0,4.0
2292,"Okay? So the execution of our program actually starts here,",9272.0,4.0
2293,the first message that we see on the terminal is the start message. After,9276.0,4.0
2294,"that, Python sees that we are calling the greet function, so",9280.0,4.0
2295,it will jump over here and then execute these two lines.,9284.0,4.0
2296,"Then, it will jump out of this function and continue the normal",9288.0,4.0
2297,execution of our program so it will print the finish message on the terminal.,9292.0,4.0
2298,So this is how functions work. Also note that the order of this,9296.0,4.0
2299,"code matters, so here we're calling the greet function after",9300.0,4.0
2300,after we have defined it. If you try and call it before you define it you will see an error.,9304.0,4.0
2301,"For example, if we call the greet",9308.0,4.0
2302,"user function right here, see we immediately get this red underline",9312.0,4.0
2303,"which says unresolved reference, greet user which basically",9316.0,4.0
2304," means python doesn't know what is this greet user, it's not defined anywhere. ",9320.0,4.0
2305,"So we always define our functions first, and then ",9324.0,4.0
2306,call them. ,9328.0,4.0
2307,Here's a function we created in the last tutorial,9332.0,4.0
2308,"now I got a question for you, what is the difference between",9336.0,4.0
2309,calling this functions nd the print function of python? The difference ,9340.0,4.0
2310,"is that the print function takes some information, in this case ",9344.0,4.0
2311,"the message that we want to print, but our greet function doesn't take ",9348.0,4.0
2312,any information. Wouldn't it be nicer if you could pass the name of the user here and then,9352.0,4.0
2313,"instead of saying hi there, you could print the name of the user. So, ",9356.0,4.0
2314,"in this tutorial, I'm going to show you how to pass information to your functions, and ",9360.0,4.0
2315,"that is pretty easy, so back to the definition of our greet",9364.0,4.0
2316,"user function, inside of these parenthesis, we can add parameters",9368.0,4.0
2317,these parameters are pale holders for receiving information. ,9372.0,4.0
2318,"For example, you can add a name parameter, and we can pass the",9376.0,4.0
2319,name of the user when calling this function. So let's pass Jon,9380.0,4.0
2320,"here, now when we call this function and pass this value",9384.0,4.0
2321,this name parameter will be set to Jon. So it,9388.0,4.0
2322,will act like a local variable that we defined inside of this function. ,9392.0,4.0
2323,"Just imagine, we didn't have this parameter, and instead we had ",9396.0,4.0
2324,a variable like name that was set to jump. Now here we could simply ,9400.0,4.0
2325,"print the name of this user, so we could use a formatted string, ",9404.0,4.0
2326,"and print the value of the name variable, right? Now, ",9408.0,4.0
2327,we don't really have this local variable defined in this function,9412.0,4.0
2328,"we have a parameter, it's exactly the same thing. So ",9416.0,4.0
2329,with these parameters we can receive information in our functions. Now let's go ahead and,9420.0,4.0
2330,"run this program, so take a look. ",9424.0,4.0
2331,"We get Hi John welcome aboard, we can take this to the next ",9428.0,4.0
2332,level. Now we can call this function one more time. So ,9432.0,4.0
2333,"greet user, and this time supply a different name. Let's say Mary. ",9436.0,4.0
2334,So we are reusing our greet function and passing it a different,9440.0,4.0
2335,value. Imagine if we didn't have this function you would have to ,9444.0,4.0
2336,"repeat this line twice , once for hi jon and another time for hi mary. ",9448.0,4.0
2337,"So this is the benefit of defining functions, we can take a few",9452.0,4.0
2338,lines of code that have a specific purpose and put them inside of a ,9456.0,4.0
2339,"function, so now let's run our program one more time",9460.0,4.0
2340,"there you go. So you get hi job, welcome aboard, then you get hi mary",9464.0,4.0
2341,welcome aboard. Now note that when a function has a parameter ,9468.0,4.0
2342,we are obligated to pass a value for that parameter. ,9472.0,4.0
2343,So if you remove jon from here and run ,9476.0,4.0
2344,"our program, we get this type error, greet user, ",9480.0,4.0
2345,missing one required positional argument. ,9484.0,4.0
2346,"Argument in programming is the value that we supply to a function, so",9488.0,4.0
2347,"back to this example, marrying this case is an",9492.0,4.0
2348,argument that we pass to the name parameter. And lot of,9496.0,4.0
2349,programmers don't know the difference between parameters and arguments and think they are the same. ,9500.0,4.0
2350,"But they are not, parameters are the holes or placeholders",9504.0,4.0
2351,"that we define in our function for receiving information, ",9508.0,4.0
2352,arguments are the actual pieces of information that we supply to these functions. ,9512.0,4.0
2353,"Okay? So, let's bring back ",9516.0,4.0
2354,"this jon string, now we can also define multiple ",9520.0,4.0
2355,"parameters, for example, let's rename this parameter to first name as I told ",9524.0,4.0
2356,"you before, you can right click here, go to refactor and then ",9528.0,4.0
2357,"rename, or preferably you can use a short cut. So the shortcut for",9532.0,4.0
2358,this on Mac is shift and f6. ,9536.0,4.0
2359,"And this brings up the renamed dial up box, here we can change this to first ",9540.0,4.0
2360,underline name. Now we can add a second parameter ,9544.0,4.0
2361,so comma followed by last underline name ,9548.0,4.0
2362,"so back to our formatted string, let's also print ",9552.0,4.0
2363,"the last name, beautiful, so here when calling this function, ",9556.0,4.0
2364,then we can supply another argument so jon,9560.0,4.0
2365,smith and lets delete this line we don't really need it anymore ,9564.0,4.0
2366,"run our program, take a look, hi jon smith, ",9568.0,4.0
2367,so in the last tutorial you learned that whenever ,9576.0,4.0
2368,we define parameters for our functions we should always supply ,9580.0,4.0
2369,values otherwise we'll get an error. Let's look at that error one more time.,9584.0,4.0
2370,So In going to delete this second argument and only pass jon. ,9588.0,4.0
2371,"Run our program, we get this message, ",9592.0,4.0
2372,"greet user missing one required, position ",9596.0,4.0
2373,argument. So these arguments that you have here like jon ,9600.0,4.0
2374,and smith you refer to these as positional arguments. ,9604.0,4.0
2375,Which means their position or argument matters. In other,9608.0,4.0
2376,"words, the first argument we add here is the value or the first parameter ",9612.0,4.0
2377,and the second argument is the value for the second parameter. ,9616.0,4.0
2378,"So if you change their position or order, we'll get different results. ",9620.0,4.0
2379,Let's take a look. Let's pass smith first and then,9624.0,4.0
2380,"jon. Okay, good, delete, now let's",9628.0,4.0
2381,"go with this, so instead of getting Hi Jon Smith, ",9632.0,4.0
2382,we get hi smith jon. So that is the reason we refer,9636.0,4.0
2383,"to these arguments as positional arguments, they're positioned or",9640.0,4.0
2384,"order matters. But in python we also have keyword arguments, and ",9644.0,4.0
2385,"with those the position doesn't matter. Let me show you how they work. So, ",9648.0,4.0
2386,let's say here you want to pass Jon as the value for the first ,9652.0,4.0
2387,name parameter. We can simply specify that here. So first name ,9656.0,4.0
2388,equals jon. Now what we have here is a keyword argument. ,9660.0,4.0
2389,"the key word argument. So this combination of having the parameter name,",9664.0,4.0
2390,"followed by it's value is what we call a keyword argument, and what we get with this keyword",9668.0,4.0
2391,argument the position doesn't really matter. So here we're supplying,9672.0,4.0
2392,"Jon as an argument fort he first parameter. Now similarly, ",9676.0,4.0
2393,"we can use a keyword argument for smith, so last",9680.0,4.0
2394,"name equals smith, so that we have 2 ",9684.0,4.0
2395,keyword arguments. So with these keyword arguments we don't have to worry about,9688.0,4.0
2396,the order of the parameters. Now that doesn't mean we should always use keyword arguments. ,9692.0,4.0
2397,"Not really. Most of the time we use positional arguments, but",9696.0,4.0
2398,in certain situations these keyword arguments helming us improve ,9700.0,4.0
2399,the readability of our code. So on line 7 it's quite clear,9704.0,4.0
2400,that we are supplying smith as the last name and jon,9708.0,4.0
2401,"as the first name. Now in this particular example, even if we didn't have",9712.0,4.0
2402,"the keyword arguments, just passing two positional arguments like jon ",9716.0,4.0
2403,"and smith, would be sufficient, because it's easy to guess",9720.0,4.0
2404,what is the purpose of these arguments. But sometimes you're dealing with functions,9724.0,4.0
2405,"and you're passing numerical values to them, in those situations",9728.0,4.0
2406,it may not be quite clear what those values represent. Let me show you an example.,9732.0,4.0
2407,"Let's say we have a function for calculating the total cost of an order, ",9736.0,4.0
2408,"so we still call that calculate, underline cost, ",9740.0,4.0
