,text,start,duration
3408,"are kind of an advanced topic, and they are beyond the scope of this beginners ",13784.0,4.0
3409,python course. But for now all you need to know is we can iterate ,13788.0,4.0
3410,or loop through these generator objects. So instead of ,13792.0,4.0
3411,"printing this generator object, let's just iterate over it using ",13796.0,4.0
3412,"a for loop, so, for, file in, ",13800.0,4.0
3413,the generator object that is returned from the glob method. q,13804.0,4.0
3414,Let's print file. ,13808.0,4.0
3415,"We run our program, there you go. So these are all the",13812.0,4.0
3416,"py files in my current directory, this could be different on your machine",13816.0,4.0
3417,"if you didn't follow the exercises I gave you earlier. For example, this",13820.0,4.0
3418,"utils.py, we created this as part of one of the exercises earlier in this course. ",13824.0,4.0
3419,So don't worry if the files you see here are different on your machine. ,13828.0,4.0
3420,"So, you can use the glob method to search for files using ",13832.0,4.0
3421,"a pattern, we can also get all the files and directories in the current ",13836.0,4.0
3422,"path, so, we just use one asterisk, then",13840.0,4.0
3423,"run our program, take a look,  so we have this",13844.0,4.0
3424,"ecommerce directory, we have notes.txt, this is a file I ",13848.0,4.0
3425,added earlier just to write notes as part of my presentation so you're not going to have,13852.0,4.0
3426,this file. We also have a bunch of directories and files. ,13856.0,4.0
3427,Even though python's standard library is comprehensive and has ,13864.0,4.0
3428,"so many modules for common tasks, it's not complete by any means. ",13868.0,4.0
3429,That's why we have this directory called python package ,13872.0,4.0
3430,index. Or pypi. And in this directory you can find hundreds ,13876.0,4.0
3431,of packages for doing awesome things. These are packages that people like you,13880.0,4.0
3432,"and I have built as part of our projects, and then they have published it as part of this directory. ",13884.0,4.0
3433,"For other people to use. So that's why we have a fantastic community in python, ",13888.0,4.0
3434,there are so many python developers out there and there are so many packages ,13892.0,4.0
3435,"right in front of us to reuse in our programs, let's say",13896.0,4.0
3436,"you want to send text messages in your programs, you don't have to build this functionality from scratch, ",13900.0,4.0
3437,we can simply come to pypi.org and ,13904.0,4.0
3438,search for sms aas you can see there are so many ,13908.0,4.0
3439,projects or apckages that give you this functionality. Of course not every,13912.0,4.0
3440,"package, not every project is complete or bug free, some of them are still ",13916.0,4.0
3441,"in development or they have bugs, but if you look around I'm pretty sure ",13920.0,4.0
3442,for any kind of function you can imagine there is a good ,13924.0,4.0
3443,"reliable and well documented package for you. In my complete python course, ",13928.0,4.0
3444,I will show you some of those most useful packages on pypi. For example,13932.0,4.0
3445,you will learn how to access the information on yelp.com in your,13936.0,4.0
3446,programs. So you can write a program and search for businesses ,13940.0,4.0
3447,registered on Yelp. Let's say you want to search for the best barber ,13944.0,4.0
3448,in New York City. I will show you how to do that. You will also learn how to use a technique called ,13948.0,4.0
3449,"web scraping, which means you can build an engine and have that engine ",13952.0,4.0
3450,"browse a website, and extract information from HDML files.",13956.0,4.0
3451,This is the same technique that Google does to index various,13960.0,4.0
3452,"websites. So they have several engines, or web crawlers, these web crawlers ",13964.0,4.0
3453,are continuously looking at various websites and extracting information ,13968.0,4.0
3454,from their pages. When you publish a blog post Google's web crawler ,13972.0,4.0
3455,"finds the title of your post, its keywords and so on. So, ",13976.0,4.0
3456,"I'm going to show you how to do that with Python, we'll also look at browser automation, and this is extremely ",13980.0,4.0
3457,"powerful, because you can automate testing of your web",13984.0,4.0
3458,"applications. So you might get a job as a test engineer, and ",13988.0,4.0
3459,"your daily job is to browse a website, click here and there, fill out this form, that form, and ",13992.0,4.0
3460,ensure that this website is functioning properly. You can automate all that ,13996.0,4.0
3461,"with a powerful python package called selenium, as I have shown in my complete, as I show in my complete",14000.0,4.0
3462,"python course. Now in this tutorial, I'm going to show you how to install",14004.0,4.0
3463,"packages, from pypi.org. So, ",14008.0,4.0
3464,here on pypi.org let's search for open py,14012.0,4.0
3465,xl. This is a package that we use for working with excel ,14016.0,4.0
3466,"spreadsheets. So let's search for this package, there you go, so currently ",14020.0,4.0
3467,"it's at version 2.5. On the top you can see, ",14024.0,4.0
3468,this instruction pip install open pyexcel. ,14028.0,4.0
3469,this is the command that we need to type in the terminal window to,14032.0,4.0
3470,"install this package into our program, so back to pycharm, ",14036.0,4.0
3471,here on the status bar. You can open up a terminal window for executing ,14040.0,4.0
3472,"various commands. So let's open it, now if you're on Windows ",14044.0,4.0
3473,"you're probably going to see something different instead of this dollar sign, don't worry about that",14048.0,4.0
3474,just execute this command I'm going to show you. So pip,14052.0,4.0
3475,install open py xl,14056.0,4.0
3476,"Make sure to spell everything properly. So pip is the tool, ",14060.0,4.0
3477,"that comes with a python installation, and we use it to install or uninstall",14064.0,4.0
3478,"packages registered on pypi.org. So here, ",14068.0,4.0
3479,we're using pip to install this package. open py ,14072.0,4.0
3480,"xl. Enter, let's go ahead with that, it's going to take a few ",14076.0,4.0
3481,"seconds, oaky done, now we can import this package and it's",14080.0,4.0
3482,"modules just like the built in modules in python, or the modules that we have",14084.0,4.0
3483,in our project. Now if you're curious where this package,14088.0,4.0
3484,"is stored on disc let me show you. So open up the project panel, ",14092.0,4.0
3485,"and then expand external libraries, next",14096.0,4.0
3486,"expand python 3, and then expand sight packages. ",14100.0,4.0
3487,This is where all these packages that we installed with pip are stored. ,14104.0,4.0
3488,"So here we have open py xl, you can open this, ",14108.0,4.0
3489,"in this folder we have another folder called cell, now",14112.0,4.0
3490,"Now, look what we have here you have this init",14116.0,4.0
3491,"type, earlier I told you that whenever we add this file to a folder, python treats",14120.0,4.0
3492,"that folder as a package, so sell is a package, and this",14124.0,4.0
3493,"package we have is modules. Sell, interface, read only and text. ",14128.0,4.0
3494,"So as you can see, this package openpyxl has several",14132.0,4.0
3495,"subpackages like cell, start, chart sheet and so on. ",14136.0,4.0
3496,"And in each package we have several modules, in the next tutorial",14140.0,4.0
3497,I will show you how to work with excel files. ,14144.0,4.0
3498,"So we have covered all the core concepts in Python, I hope you have learned a lot. ",14148.0,4.0
3499,please support my hard work by liking this video and sharing it with others. ,14152.0,4.0
3500,And be sure to subscribe to my channel for more tutorials like this. Next we're,14156.0,4.0
3501,going to work on our first python project that involves automation. ,14160.0,4.0
3502,You're going to write a python program that can process thousands of spreadsheets,14164.0,4.0
3503,in under a second. Are you excited? Let's get started.,14168.0,4.0
3504,In this tutorial I'm going to show you something really awesome you can do with python. You're going to ,14176.0,4.0
3505,"learn how to process spreadsheets, and this is extremely valuable",14180.0,4.0
3506,in situation where you have hundreds or thousands of spreadsheets that need to,14184.0,4.0
3507,be updated. If you want to do this by hand it may take hours or days ,14188.0,4.0
3508,"weeks, or even months, you can simply build a python program in less then ",14192.0,4.0
3509,"half an hour. And have that python program, automatically process thousands of spreadsheets",14196.0,4.0
3510,"in under one second. So, here we're going to work on this",14200.0,4.0
3511,excel spreadsheet. You can download this below this video.,14204.0,4.0
3512,"In this spreadsheet we have three columns, transaction ID,",14208.0,4.0
3513,"product ID, and press. Now don't worry about the fourth column yet. ",14212.0,4.0
3514,"So in this spreadsheet we're going to record all kinds of transactions, but let's say",14216.0,4.0
3515,"due to an error, it could be a human error or a system error. The price that we have",14220.0,4.0
3516,here is wrong. Let's say we need to decrease this by 10 percent. ,14224.0,4.0
3517,"If you want to do this manually, we'll have to come back here and ",14228.0,4.0
3518,"add a formula, so we typed out equal sign, let's say you want to recalculate",14232.0,4.0
3519,say you want to recalculate the value of this cell.,14236.0,4.0
3520,have to get that and then multiply it by 0.9,14240.0,4.0
3521,"and that is like 90% of the original price, we are reducing the original",14244.0,4.0
3522,reducing the price by 10%. Now when you hit enter you can see the updated price. ,14248.0,4.0
3523,"Next we'll have to come back here, select this cell and",14252.0,4.0
3524,apply the same formula to all the other rows. Now what if you have thousands of rows,14256.0,4.0
3525,"here? You'll have to scroll up and down, this is going to be very tedious. ",14260.0,4.0
3526,So we're going to write a python program that will do this for us. It's going to,14264.0,4.0
3527,auotmate this process and not only that it will also,14268.0,4.0
3528,"add this beautiful chart right here, ",14272.0,4.0
3529,once again if you want to open up hundreds or thousands of spreadsheets ,14276.0,4.0
3530,"and add a chart to each one, this is going to take at least a week or two",14280.0,4.0
3531,Our python program is going to do all of this in a matter of seconds.,14284.0,4.0
3532,"So, let's get started. Alright the first thing I want you to do is",14288.0,4.0
3533,to download this transactions file and add it to your project. ,14292.0,4.0
3534,I put the link below this video for you to download. So if you're wondering ,14296.0,4.0
3535,"how to put this in this project, you can simply right click the project, ",14300.0,4.0
3536,and if you're on Mac you have this item where,14304.0,4.0
3537,"reveal in finder, if you're on Windows you should see something like reveal",14308.0,4.0
3538,"in explorer, or file explorer, or whatever it's called",14312.0,4.0
3539,"when you click this, this opens up the direct ",14316.0,4.0
3540,on your machine where this is stored. So simply copy paste,14320.0,4.0
3541,"the transactions file right here. Now, ",14324.0,4.0
3542,"here on the top, first we need to import the open py excel package. ",14328.0,4.0
3543,"So import open py excel, we can give it a ",14332.0,4.0
3544,an alias to make our code shorter. So asxl. ,14336.0,4.0
3545,This is not required but it just makes our code a little bit cleaner. ,14340.0,4.0
3546,Let me show you. So now instead of typing open pyxl.,14344.0,4.0
3547,we type xl. okay so that's an alias for,14348.0,4.0
3548,this package. Now in this package we have a function for loading an xl ,14352.0,4.0
3549,"workbook. So let's call load workbook, ",14356.0,4.0
3550,and as the argument we pass transactions. ,14360.0,4.0
3551,.xlsx. So this we load,14364.0,4.0
3552,our excel workbook and return a workbook object. ,14368.0,4.0
3553,"Okay? Now if you open this workbook, you can see you add only 1",14372.0,4.0
3554,"sheet, and that is called sheet 1, so to access that you use ",14376.0,4.0
3555,"square brackets, and specify the name of the sheet, ",14380.0,4.0
3556,"that is sheet one, make sure to spell this with a capital ",14384.0,4.0
3557,"S. Because this is case sensitive, if you don't spell it properly ",14388.0,4.0
3558,"you're going to get an error, so this returns a sheet, ",14392.0,4.0
3559,"now in this sheet, we have various cells. So",14396.0,4.0
3560,"next you need to learn how to access a particular cell, and that is very easy.",14400.0,4.0
3561,"back to py charm, with this sheet object, you can use ",14404.0,4.0
3562,square brackets and give the coordinate of a cell. ,14408.0,4.0
3563,Coordinate is the combination of the column and the row. ,14412.0,4.0
3564,"For example, this cell it's coordinate is a1. ",14416.0,4.0
3565,"So back to pycharm, we can type a1, and this returns ",14420.0,4.0
3566,"our first cell. Also, there is another approach to getting",14424.0,4.0
3567,"a cell, instead of using square brackets with a string, we can",14428.0,4.0
3568,"use the cell method of the sheet object, so, ",14432.0,4.0
3569,"sheet.cell, you pass the row and the column, so row ",14436.0,4.0
3570,and column 1 these return the exact same ,14440.0,4.0
3571,"cell. Now let's print the value of this cell, cell.value",14444.0,4.0
3572,and run our program so ,14448.0,4.0
3573,"the value is transaction id, beautiful, ",14452.0,4.0
3574,so now we need to iterate over all these rows and for each row we need to get the value ,14456.0,4.0
3575,in the third column. That is the price. We'll get that and then multiply ,14460.0,4.0
3576,by 0.9. So first we need to know how many rows ,14464.0,4.0
3577,we have in this spreadsheet. We can get that from the sheet object so sheet,14468.0,4.0
3578,has an attribute called mx_,14472.0,4.0
3579,"row. Let's print this, so in this sheet, ",14476.0,4.0
3580,"we have 4 row, and you can verify that here. So we have",14480.0,4.0
3581,a total of 4 rows. So we need to add a for loop.,14484.0,4.0
3582,"that would generate the numbers 1-4. So, ",14488.0,4.0
3583,"let's delete this print statement, nd add a for loop ",14492.0,4.0
3584,"for row in were going to use the range function unction to generate a range of numbers, ",14496.0,4.0
3585,"starting from 1, all the way to sheet ",14500.0,4.0
3586,.max_grow. Plus 1. The reason we're ,14504.0,4.0
3587,"adding 1 to this, is because as I told you before this range function ",14508.0,4.0
3588,"will generate numbers, starting from this value all the way to this",14512.0,4.0
3589,"value, but it will not include the second value. So currently ",14516.0,4.0
3590,"max row returns 4, if you use range of 1-4 this will generate ",14520.0,4.0
3591,"the numbers 1, 2, and 3, but not 4. ",14524.0,4.0
3592,"So to include 4, we need to add 1 to it. Let's go over here, ",14528.0,4.0
3593,so we tied sheet.max underline row plus 1. ,14532.0,4.0
3594,Now before going any further let's just print row and make,14536.0,4.0
3595,sure our program is working up to this point. So let's run ,14540.0,4.0
3596,"this, we get the numbers 1-4 beautiful. ",14544.0,4.0
3597,So now we can easily get the cells in the third column. However,14548.0,4.0
3598,"we don't really want this first cell, that's the heading. ",14552.0,4.0
3599,"so technically you want to ignore the first row. Back here, you want to change ",14556.0,4.0
3600,"our range function, and start from 2. Now, ",14560.0,4.0
3601,we're going to use sheet.cell to get access to the cell,14564.0,4.0
3602,at this row. And the column should be 3. ,14568.0,4.0
3603,"We get a cell object, let's print it's value",14572.0,4.0
3604,"and make sure you're on the right track, so run the program",14576.0,4.0
3605,these are the values we get. 5.95,14580.0,4.0
3606,6.95 and 7.95 these are the,14584.0,4.0
3607,values of the third column. Next we need to multiply each,14588.0,4.0
3608,value by 0.9 so instead of printing ,14592.0,4.0
3609,cell.value we multiplied by 0.9 and this is,14596.0,4.0
3610,"the corrected underline price, ",14600.0,4.0
3611,"so this is the mistake we're going to make with our program, now",14604.0,4.0
3612,"we need to add a new cell to our worksheet, so we want to add all the corrected",14608.0,4.0
3613,"prices, ia  new column, it could also overwrite the values in this column, ",14612.0,4.0
3614,but in this tutorial I'm going to show you how to add a new column.,14616.0,4.0
3615,"So using the same method, now we need to get a reference to the cell, to the given ",14620.0,4.0
3616,"row, but in the fourth column. So, we call sheet",14624.0,4.0
3617,".cell, and pass row and four as the arguments. ",14628.0,4.0
3618,"Once again, this returns a cell object, let's store that in a ",14632.0,4.0
3619,separate variable and call it,14636.0,4.0
3620,price_cell. So note that my variable names are ,14640.0,4.0
3621,very descriptive. There is no guess work. You have corrected price which holds,14644.0,4.0
3622,"actual value and we have corrected price, which is a cell",14648.0,4.0
3623,object in this spreadsheet. Next we have to set the value in this,14652.0,4.0
3624,cell. So we set corrected price cell.,14656.0,4.0
3625,value to this corrected price. With these few lines ,14660.0,4.0
3626,"we can easily update our spreadsheet, but first we need to save it. So, ",14664.0,4.0
3627,"after our for loop, we call workbook.",14668.0,4.0
3628,save. Now let's save this in a new file because we don't want to,14672.0,4.0
3629,accidentally overwrite the original file in case our program has a bug,14676.0,4.0
3630,"so, I'm going to call that transactions 2.sms ",14680.0,4.0
3631,"ex. And finally let's run our program, ",14684.0,4.0
3632,"so, you can see that happened in a split of a second, now here we have a new file",14688.0,4.0
3633,tranactions 2. When we open this we get something like this. ,14692.0,4.0
3634,So you can see we have this 4th column with the updated prices. Beautiful.,14696.0,4.0
3635,"So half of the problem is solved, now we need to add a chart here.",14700.0,4.0
3636,"To add a chart, we need to add a couple classes on the top, so, ",14704.0,4.0
3637,after this import statement let's type out from ,14708.0,4.0
3638,"open py excel.chart, import, bar chart, ",14712.0,4.0
3639,"comma, reference. ",14716.0,4.0
3640,So lets see what's going on here. In this package you have a module ,14720.0,4.0
3641,"chart, and from this module we're importing two classes, bar chart, ",14724.0,4.0
3642,"and reference. Again, look at the naming convention used ",14728.0,4.0
3643,here. The first letter of e very word is capitalized. Also it's better,14732.0,4.0
3644,to add a line break after our import statements to make our,14736.0,4.0
3645,"code cleaner. So, before we save our workbook, we need to",14740.0,4.0
3646,add achart to the current sheet. First we need to select a range ,14744.0,4.0
3647,"of values. For this exercise, I'm going to select the values in the fourth column/.",14748.0,4.0
3648,So all the values in rows 2-4 these are,14752.0,4.0
3649,the values I'm going to use in our chart. Now in this part 2 example it doesn't really,14756.0,4.0
3650,"make sense to add a chart per transaction, but that doesn't really matter",14760.0,4.0
3651,"we just want a bunch of numbers to create a chart, so after our",14764.0,4.0
3652,"for loop, we're going to use the reference class to select a range of",14768.0,4.0
3653,values. Now the first argument in the constructor is the,14772.0,4.0
3654,"sheet. So we pass our sheet here, then we add",14776.0,4.0
3655,"4 keyword arguments, the first one is min_row, we set this to",14780.0,4.0
3656,2. The second one is max_row we set,14784.0,4.0
3657,"this to the maximum row in this sheet. That is sheet, ",14788.0,4.0
3658,".max_row, so we want to select the cells in row",14792.0,4.0
3659,2-4. kay? Now to make this code a little bit cleaner ,14796.0,4.0
3660,"I'm going to put this on a new line, so we",14800.0,4.0
3661,"can see clearly, now this is going to select all the cells ",14804.0,4.0
3662,in all the columns in these rows. That's not what we want. ,14808.0,4.0
3663,"we only want the values in the fourth column, so back here",14812.0,4.0
3664,we need to set a couple more key word arguments men_call,14816.0,4.0
3665,"or column, we set that to for, and also ",14820.0,4.0
3666,"max underline call, we set that to 4 as well. So we are limiting the range",14824.0,4.0
3667,of cells we're selecting to the fourth column. ,14828.0,4.0
3668,"Now, we're creating an instance of the reference class, let's store the",14832.0,4.0
3669,"result in a variable called values, so this values object ",14836.0,4.0
3670,"will have all these values in the fourth column, now we are ready to create ",14840.0,4.0
3671,"a chart, so we create an instance of the bar chart class",14844.0,4.0
3672,and store it in this object. ,14848.0,4.0
3673,"Next, we call chart.add_date and ",14852.0,4.0
3674,pass our values. That is pretty straight forward finally we need to add this chart ,14856.0,4.0
3675,"to our sheet. So, we call sheet, ",14860.0,4.0
3676,.add_chart and pass this chart object ,14864.0,4.0
3677,We should also specify where we want to add this chart.,14868.0,4.0
3678,"let's say we want to add it here, on row 2, after the fourth column. ",14872.0,4.0
3679,"So the coordinate of this cell is e2, and this is going to be, ",14876.0,4.0
3680,the top left corner of our chart. So as the coordinate I'm going to,14880.0,4.0
3681,"pass e2 that's all we had to do, done. Let's run our",14884.0,4.0
3682,"program one more time, beautiful, let's open up the update",14888.0,4.0
3683,"workbook. And here's the end result, so",14892.0,4.0
3684,"right after the fourth column, we have this beautiful chart. Now we could take this to the next level, ",14896.0,4.0
3685,"we could add a legend here, we could change the color of these bars, we could even use a different ",14900.0,4.0
3686,"kind of chart, it doesn't have to be a bar chart. So to learn more about this we can",14904.0,4.0
3687,read the documentation for openpyxl. So,14908.0,4.0
3688,"our program is complete, for our code is dirty, it's not clean, it's not ",14912.0,4.0
3689,organized. We don't have any functions here. We have written all the code in app.py. ,14916.0,4.0
3690,So let's goo ahead and organize this code like a professional software developer. ,14920.0,4.0
3691,"So, on line 4, we are loading our workbook ",14924.0,4.0
3692,"then we're getting a reference to the first sheet, but we don't really need these two lines here ",14928.0,4.0
3693,"this is purely for demonstration to show you how to access a cell. So, ",14932.0,4.0
3694,"let's delete these unnecessary lines, this is a very important practice",14936.0,4.0
3695,"as you're coding always look at your code, always review it, see if you have some code that is",14940.0,4.0
3696,"not used. Always delete those. Okay, next we are iterating over ",14944.0,4.0
3697,"all the rows, fixing the prices, and then ",14948.0,4.0
3698,"we select the values to add a chart, and finally we save the workbook. ",14952.0,4.0
3699,"Now, if you were going to use this to automate the process of updating",14956.0,4.0
3700,"thousands of spreadsheets, this program wouldn't work, because it's only ",14960.0,4.0
3701,"relying on this file. So we want o reorganize this code, and ",14964.0,4.0
3702,move it inside of a function. This function should take the name of a function,14968.0,4.0
3703,So let's define a function. Let's,14972.0,4.0
3704,call it process_workbook. ,14976.0,4.0
3705,"It gets a file name. Now, we move all the code inside ",14980.0,4.0
3706,"of this function, so let's select everything, and press",14984.0,4.0
3707,"tab, beautiful, now back",14988.0,4.0
3708,"to our function, instead of loading this transactions file we're going to load",14992.0,4.0
3709,"this file name, that's better, ",14996.0,4.0
3710,"Also, now that our program is working properly, there is really no need to store the",15000.0,4.0
3711,result in a separate file. So here we can,15004.0,4.0
3712,simply overwrite the same file. So let's pass,15008.0,4.0
3713,"file name, that is the end of our function, so, ",15012.0,4.0
3714,"now, we have this reusable function, we can simply reuse this",15016.0,4.0
3715,to process thousands of spreadsheets. Earlier in this python course you learned ,15020.0,4.0
3716,"how to find all the files in a  directory, so we can get each file in a directory ",15024.0,4.0
3717,"and pass the name of the file to this function, this function will go",15028.0,4.0
3718,ahead and update this spreadsheet in just a second or less. ,15032.0,4.0
3719,"So, that was just one example of using python to automate ",15036.0,4.0
3720,repetitive boring task that waste your time. But automation is not,15040.0,4.0
3721,"just about processing excel spreadsheets, there are so many things we can automate. ",15044.0,4.0
3722,"Here's a question for you, what do you want to automate, how do you want to use python to make your",15048.0,4.0
3723,life easier? Use the comment box below and let me know. I love to,15052.0,4.0
3724,"hear about your ideas. Next we're going to work on  project which involves machine learning, which is a ",15056.0,4.0
3725,subset of artificial intelligence. Are you excited? ,15060.0,4.0
3726,Let's get started. ,15064.0,4.0
3727,"In this section, you're going to learn about machine learning, which is a subset of",15068.0,4.0
3728,"AI or artificial intelligence. It's one of the trending topics in the world, ",15072.0,4.0
